"batch_id","lab_batch_id","institution_name","batch_notes","num_sample","num_results","analytes"
414,NULL,NULL,"USGS NGDB table xtbIcpaesChem, total digestion, percent values, whole (none below or above detection)","97110","83541","Al, Ca, Fe, K, Mg, Na, P, Si, Ti"
415,NULL,NULL,"USGS NGDB table xtbIcpaesChem, total digestion, ppm values, whole (none below or above detection)","491220","201640","Ag, As, Au, B, Ba, Be, Bi, Cd, Ce, Co, Cr, Cu, Dy, Er, Eu, Ga, Gd, Ge, Hg, Ho, La, Li, Lu, Mn, Mo, Nb, Nd, Ni, Pb, Pr, Sc, Sm, Sn, Sr, Ta, Tb, Th, Tm, U, V, W, Y, Yb, Zn, Zr"
416,NULL,NULL,"USGS NGDB table xtbIcpaesChem, partial digestion, ppm values, whole (none below or above detection)","59520","11587","Ag, Al, As, Au, Ba, Be, Bi, Ca, Cd, Ce, Co, Cr, Cu, Fe, K, La, Li, Mg, Mn, Mo, Na, Ni, P, Pb, Sb, Sn, Sr, Ti, V, Y, Zn, Zr"
417,NULL,NULL,"USGS NGDB table xtbIcpmsChem percent values, whole (none below or above detection), assumed total digestion","920","781","Al, Ca, Fe, K, Mg, Na, P, S, Si, Ti"
418,NULL,NULL,"USGS NGDB table xtbIcpaesChem, total digestion, ppm values, whole (none below or above detection)","16473","6482","Ag, As, Au, Ba, Be, Bi, Cd, Ce, Co, Cr, Cs, Cu, Dy, Er, Eu, Ga, Gd, Ge, Hf, Ho, In, La, Li, Mn, Mo, Nb, Nd, Ni, Pb, Pr, Rb, Re, Sb, Sc, Se, Sm, Sn, Sr, Ta, Tb, Te, Th, Tl, Tm, U, V, W, Y, Yb, Zn, Zr"
420,NULL,NULL,"USGS NGDB table xtbMajorChem, ICP:AES values","320","40","Al2O3, CaO, Fe2O3, K2O, MgO, MnO, Na2O, P2O5, SiO2, TiO2"
421,NULL,NULL,"USGS NGDB table xtbMajorChem, clr values","1344","1005","Al2O3, Fe2O3, MnO, P2O5, SiO2, TiO2"
422,NULL,NULL,"USGS NGDB table xtbMajorChem, XRF values","80399","64865","Al2O3, CaO, Cl, Fe2O3, K2O, MgO, MnO, Na2O, P2O5, SiO2, TiO2"
423,NULL,NULL,"USGS NGDB table xtbMajorChem, msc values","163740","21587","CO2, Cl, F, FeO, H2O_m, H2O_p, H2O_t, LOI, S, S_ORG, S_SFD, S_SO4"
424,NULL,NULL,"USGS NGDB table xtbMajorChem, aa values","4368","2677","Al2O3, CO2, CaO, Fe2O3, FeO, K2O, MgO, MnO, Na2O, P2O5, SiO2, TiO2"
425,NULL,NULL,"USGS NGDB table xtbMajorChem, unk values","157556","67625","Al2O3, CO2, CaO, Cl, F, Fe2O3, FeO, K2O, MgO, MnO, Na2O, P2O5, SiO2, TiO2"
426,NULL,NULL,"USGS NGDB table xtbMajorChem, ttr values","28074","10589","CO2, FeO, TIC"
427,NULL,NULL,"USGS NGDB table xtbMajorChem, dff values","9051","9051","TOC"
428,NULL,NULL,"USGS NGDB table xtbMajorChem, cmb values","12067","12067","C"
430,NULL,NULL,"USGS NGDB table xtbMajorChem, elctrd values","2224","1212","Cl, F"
431,NULL,NULL,"USGS NGDB table xtbNaaChem, percent values, whole (no above or below detection)","7408","4398","Ca, Fe, K, Na"
432,NULL,NULL,"USGS NGDB table xtbNaaChem, ppm, ppb values, whole (no above or below detection)","63822","40664","As, Ba, Br, Ce, Co, Cr, Cs, Dy, Eu, Gd, Hf, Hg, Ho, La, Lu, Mn, Nd, Ni, Rb, Sb, Sc, Se, Sm, Sr, Ta, Tb, Th, Tm, U, W, Yb, Zn, Zr"
434,NULL,NULL,"USGS NGDB table xtbNaaChem, dna ppm values, whole (no above or below detection)","13968","10758","Th, U"
435,NULL,NULL,"USGS NGDB table xtbNaaChem, eq ppm values, whole (no above or below detection)","2419","2419","U"
436,NULL,NULL,"USGS NGDB table xtbXrfChem, ppm values, whole (no above or below detection)","55100","22093","Ag, As, Ba, Bi, Br, Cd, Ce, Cr, Cs, Cu, Ga, Ge, La, Mo, Nb, Ni, Pb, Rb, Sb, Se, Sn, Sr, Th, U, V, W, Y, Zn, Zr"
437,NULL,NULL,"USGS NGDB table xtbOtherChem, aa ppm and pct values, whole (no above or below detection)","139403","12422","Ag, As, Au, Bi, Ca, Cd, Co, Cr, Cu, Hg, K, Na, Ni, Pb, Pd, Pt, Sb, Se, Sr, Te, Tl, U, Zn"
438,NULL,NULL,"USGS NGDB table xtbOtherChem, clr values, total digests, whole (no below or above detection)","3992","945","Ag, As, Au, Ba, P, Sb, V, W"
439,NULL,NULL,"USGS NGDB table xtbOtherChem, clr values, partial and total digests, whole (no below or above detection)","4","2","Cu, U"
440,NULL,NULL,"USGS NGDB table xtbOtherChem, msc values, whole (no below or above detection)","90","30","W"
441,NULL,NULL,"USGS NGDB table xtbOtherChem, flr values, whole (no below or above detection)","116","116","U"
442,NULL,NULL,"USGS NGDB table xtbOtherChem, fa values, whole (no below or above detection)","1932","497","Au, Ir, Pd, Pt, Rh, Ru"
443,NULL,NULL,"USGS NGDB table xtbUnknownChem, unk values, pct, whole","402940","117316","Ag, Al, As, Au, Br, Ca, Cu, Fe, Hg, I, K, Mg, Na, Ni, P, Pb, Si, Ti, V, Zn"
444,NULL,NULL,"USGS NGDB table xtbUnknownChem, unk values, ppm, whole","1491782","301546","Ag, Al, As, Au, B, Ba, Be, Bi, Br, Cd, Ce, Co, Cr, Cs, Cu, Dy, Er, Eu, Ga, Gd, Ge, Hf, Hg, Ho, I, In, Ir, La, Li, Lu, Mn, Mo, Nb, Nd, Ni, Os, Pb, Pd, Pr, Pt, Rb, Re, Sb, Sc, Se, Sm, Sn, Sr, Ta, Tb, Te, Th, Ti, Tl, Tm, U, V, W, Y, Yb, Zn, Zr"
445,NULL,NULL,"USGS NGDB table xtbUnknownChem, unk values, unknown unit - assumed percent, or ppb, whole","1280","413","Ba, Cr2O3, SrO, V2O5"
446,NULL,NULL,"USGS NGDB table xtbIcpaesChem, total and partial digestion, above and below detection","10168580","165320","Ag, Al, As, Au, B, Ba, Be, Bi, Ca, Cd, Ce, Co, Cr, Cu, Dy, Er, Eu, Fe, Ga, Gd, Ge, Ho, K, La, Li, Lu, Mg, Mn, Mo, Na, Nb, Nd, Ni, P, Pb, Pr, Sb, Sc, Sm, Sn, Sr, Ta, Tb, Th, Ti, Tm, U, V, W, Y, Yb, Zn, Zr"
449,NULL,NULL,"USGS NGDB table xtbIcpmsChem, above and below detection","1452","111","Ag, As, Au, Bi, Ca, Cr, Hf, In, Li, Mo, Nb, P, Ti"
450,NULL,NULL,"USGS NGDB table xtbMajorChem, aa values, above and below detection","375","83","CO2, FeO, K2O, MnO, Na2O"
454,NULL,NULL,"USGS NGDB table xtbMajorChem, clr values, above and below detection","240","77","Al2O3, Fe2O3, MnO, P2O5, TiO2"
455,NULL,NULL,"USGS NGDB table xtbMajorChem, cmb values, above and below detection","1242","414","C"
456,NULL,NULL,"USGS NGDB table xtbMajorChem, dff values, above and below detection","4470","894","TOC"
457,NULL,NULL,"USGS NGDB table xtbMajorChem, elctrd values, above and below detection","960","121","Cl, F"
458,NULL,NULL,"USGS NGDB table xtbMajorChem, msc values, above and below detection","71015","2170","CO2, Cl, H2O_m, H2O_p, S, S_ORG, S_SFD, S_SO4"
459,NULL,NULL,"USGS NGDB table xtbMajorChem, ttr values, above and below detection","11610","1935","FeO, TIC"
460,NULL,NULL,"USGS NGDB table xtbMajorChem, unk values, above and below detection","294331","8968","Al2O3, CO2, CaO, Cl, F, Fe2O3, FeO, K2O, MgO, MnO, Na2O, P2O5, SiO2, TiO2"
461,NULL,NULL,"USGS NGDB table xtbMajorChem, xrf values, above and below detection","98448","6554","Al2O3, CaO, Cl, Fe2O3, K2O, MgO, MnO, Na2O, P2O5, SiO2, TiO2"
462,NULL,NULL,"USGS NGDB table xtbNaaChem, naa values, ppm, pct, ppb, above and below detection","1371744","2878","As, Au, Ba, Br, Ca, Ce, Cr, Cs, Eu, Fe, Gd, Hf, Hg, K, La, Lu, Na, Nd, Ni, Rb, Sb, Se, Sm, Sr, Ta, Tb, Th, Tm, U, W, Yb, Zn, Zr"
463,NULL,NULL,"USGS NGDB table xtbNaaChem, dna values, ppm, above and below detection","982383","3101","Th, U"
464,NULL,NULL,"USGS NGDB table xtbNaaChem, eq ppm values,above and below detection","8554","611","U"
465,NULL,NULL,"USGS NGDB table xtbXrfChem, ppm values,above and below detection","72334","4359","Ag, As, Ba, Bi, Br, Cd, Ce, Cr, Cs, Cu, Ga, Ge, La, Mo, Nb, Nd, Ni, Pb, Rb, Sb, Se, Sn, Sr, Th, U, V, W, Y, Zn, Zr"
466,NULL,NULL,"USGS NGDB table xtbOtherChem, aa values, ppm, pct, above and below detection","189420","4241","Ag, As, Au, Bi, Cd, Co, Hg, K, Na, Pb, Pd, Sb, Se, Sn, Te, Tl, Zn"
467,NULL,NULL,"USGS NGDB table xtbOtherChem, clr values, total digests, above and below detection","3140","392","Ag, As, Au, Mo, P, Sb, W"
468,NULL,NULL,"USGS NGDB table xtbOtherChem, fa, above and below detection","16892","1242","Au, Ir, Pd, Pt, Rh, Ru"
469,NULL,NULL,"USGS NGDB table xtbOtherChem, flr values, above and below detection","10","10","U"
470,NULL,NULL,"USGS NGDB table xtbOtherChem, ic values, above and below detection","1","1","Br"
471,NULL,NULL,"USGS NGDB table xtbOtherChem, msc values, above and below detection","26","26",NULL
482,NULL,NULL,"USGS NGDB table xtbUnknownChem, unk values, ppm, ppb, above and below detection","25895100","529216","Ag, As, Au, B, Ba, Be, Bi, Br, Cd, Ce, Co, Cr, Cs, Cu, Dy, Er, Eu, Ga, Gd, Ge, Hf, Hg, Ho, I, In, Ir, La, Li, Lu, Mn, Mo, Nb, Nd, Ni, Os, Pb, Pd, Pr, Pt, Rb, Re, Rh, Ru, Sb, Sc, Se, Sm, Sn, Sr, Ta, Tb, Te, Th, Ti, Tl, Tm, U, V, W, Y, Yb, Zn, Zr"
485,NULL,NULL,"USGS NGDB table xtbUnknownChem, unk values, pct, above and below detection","2352300","32492","Ag, Al, As, Au, Ca, Cd, Cu, Fe, K, Mg, Na, Ni, P, Pb, Si, Ti"
486,NULL,NULL,"USGS NGDB table xtbUnknownChem, unknown unit, assumed wt%, above and below detection","142","72","Cr2O3, V2O5"
487,NULL,NULL,"USGS NGDB table xtbUnknownChem, partial extraction, above and below detection","130","69","As, Bi, Cd, Sb, Zn"
